10-06-2020, В России выявили 8404 новых случая заражения коронавирусом 
10-06-2020, Ростех и РФПИ начнут производить препарат для лечения коронавируса 
10-06-2020, МВФ одобрил программу поддержки Украины на пять миллиардов долларов 
09-06-2020, Число заболевших COVID-19 в мире превысило семь миллионов 
09-06-2020, Власти спрогнозировали выход экономики Москвы на докризисные показатели 
09-06-2020, Ввергнет в депрессию. СМИ о последствиях президентства Байдена для США 
09-06-2020, В Петербурге во время пандемии число безработных выросло до 80 тысяч 
09-06-2020, Аналитики ожидают рост спроса на каршеринг из-за коронавируса 
09-06-2020, Греф: российская экономика справится лучше европейской и американской 
09-06-2020, Минпромторг предложил ограничить госзакупки медицинских масок за рубежом 
09-06-2020, Карелия с 9 июня открывает все туристические объекты 
09-06-2020, Развивающиеся страны восстановятся быстрее развитых, считает эксперт 
09-06-2020, Эксперты оценили шансы мировой экономики избежать рецессии 
09-06-2020, Мировая экономика вряд ли убежит от рецессии в 2020 году, считает эксперт 
09-06-2020, Аcсоциация операторов: до 20% фитнес-центров Москвы закроются навсегда 
09-06-2020, Ростуризм назвал дату начала полноценного курортного сезона в России 
09-06-2020, Пассажиропоток в аэропортах в Швеции снизился на 98% из-за пандемии 
09-06-2020, Дальнейшее смягчение. В Подмосковье анонсировали ослабление самоизоляции 
09-06-2020, ПСБ рассказал, как военные брали ипотеку в период ограничений из-за COVID 
09-06-2020, В Москве возобновят работу сервисы каршеринга 
08-06-2020, Трамп отметил быстрое восстановление фондового рынка после пандемии 
08-06-2020, Бизнес-омбудсмен оценила сроки восстановления сектора услуг в Москве 
08-06-2020, Всемирный банк из-за коронавируса ухудшил прогноз по спаду ВВП России 
08-06-2020, Всемирный банк предрек рекордное падение мировой экономики 
08-06-2020, Во все тяжкие: граница открывается, пропуска отменяются 
08-06-2020, В Карелии число заразившихся коронавирусом вахтовиков на ГЭС достигло 71 
08-06-2020, В Минтрансе назвали две задачи для возобновления международных полетов 
08-06-2020, В Москве продолжат дезинфицировать автомобили каршеринга 
08-06-2020, Выплаты за особые условия труда в период пандемии освободили от НДФЛ 
08-06-2020, Путин подписал закон о мерах налоговой поддержки граждан и бизнеса 
08-06-2020, Путин рассказал о том, как нужно действовать при введении льгот 
08-06-2020, ВТБ открыл более 90% своих офисов 
08-06-2020, В Москве с 16 июня заработают библиотеки, риелторские конторы и агентства 
08-06-2020, В Москве с 9 июня снимают ограничения на работу каршеринга 
08-06-2020, Собянин заявил о спаде пандемии в Москве 
08-06-2020, Путин подписал закон о налоговом капитале в один МРОТ для самозанятых 
08-06-2020, В Минкомсвязи рассказали о вывозном рейсе из Токио во Владивосток 
08-06-2020, Крупные банки не видят большого спроса на продление карт из-за COVID-19 
08-06-2020, Путин подписал закон о поддержке бизнеса и граждан в условиях пандемии 
08-06-2020, Риски из-за пандемии коронавируса еще есть, заявил Мишустин 
08-06-2020, Внутренние перелеты подешевели почти во всех странах 
08-06-2020, Россия готова постепенно открывать туристический сезон 
08-06-2020, Мишустин: каждая мера нацплана должна обеспечивать рост доходов граждан 
08-06-2020, Минфин мобилизовал в резервный фонд правительства 600 миллиардов рублей 
08-06-2020, Источник: Росавиация работает над возобновлением международных рейсов 
08-06-2020, В Москве рассказали о льготном кредитовании бизнеса 
08-06-2020, В ВЭФ рассказали о влиянии пандемии COVID-19 на цифровизацию 
07-06-2020, Украине подготовили фантастические стимулы для развития экономики 
07-06-2020, В Туве вводят двухнедельный карантин из-за COVID-19 
06-06-2020, В ИКЕА рассказали, когда и в каких российских регионах возобновят работу 
06-06-2020, IKEA 8 июня возобновит работу четырех магазинов в регионах 
06-06-2020, Источник: ОПЕК продлила текущее сокращение добычи нефти до конца июля 
06-06-2020, Поддержку культурной отрасли включили в план восстановления экономики 
06-06-2020, Путин: сфера культуры должна получить стимул для развития после пандемии 
06-06-2020, Прорыв в лечении? В РФ зарегистрировали препарат от осложнений COVID-19 
06-06-2020, На Украине число случаев COVID-19 выросло до 26 514 
05-06-2020, Собянин анонсировал радикальные решения по снятию ограничений 
05-06-2020, Росстат заявил о рекордном падении оборота предприятий общепита 
05-06-2020, Глава Росавиации раскрыл, когда можно будет улететь за рубеж 
05-06-2020, В России создали платформу для поддержки компаний, пострадавших от COVID 
05-06-2020, РФПИ продал более десяти миллионов тестов на коронавирус за рубеж 
05-06-2020, Росавиация сообщила о росте в три раза пассажиропотока в июне 
05-06-2020, Путин обсудил с главой РФПИ борьбу с коронавирусом и создание тест-систем 
05-06-2020, ЦБ не ждет быстрого восстановления экономики после спада из-за COVID-19 
05-06-2020, Набиуллина: России не грозит взрыв инфляции из-за мер по коронавирусу 
05-06-2020, МИД не видит препятствий для восстановления экономических связей с Китаем 
05-06-2020, Депутаты ЕР обсудили с Моргуловым возобновление авиасообщения с АТР 
05-06-2020, ВТБ: москвичи удвоили траты в торговых центрах 
05-06-2020, Путин в пятницу очно встретится с руководителем РФПИ Дмитриевым 
05-06-2020, Глава Еврогруппы оценил общий ответ Евросоюза на кризис из-за COVID-19 
05-06-2020, В Татарстане самозанятым вернут налогов на 139 млн рублей 
05-06-2020, Общенациональный план действий по восстановлению российской экономики 
05-06-2020, Пульсоксиметр вместо робота: как пандемия изменила интересы покупателей 
05-06-2020, Заммэра Москвы: открытие торговли удвоило темпы восстановления экономики  
05-06-2020, Центр поддержки экономики в Москве получает втрое меньше обращений 
05-06-2020, Банки попросили отложить запрет пополнять анонимные кошельки наличными 
05-06-2020, Аврора планирует на 6 июня вывозной рейс с россиянами из Бангкока 
04-06-2020, Меркель оценила сроки создания новой вакцины от COVID-19 
04-06-2020, В посольстве рассказали о вывозном рейсе с Кипра в Россию 
04-06-2020, В Краснодарском крае карантин продлили до 21 июня 
04-06-2020, Мишустин призвал изменить практику госзакупок у иностранных поставщиков 
04-06-2020, Иностранные авиакомпании снова смогут летать в один из 37 городов Китая 
04-06-2020, Исследование показало готовность компаний к восстановлению после COVID-19 
04-06-2020, Россию ждет новая модель потребления 
03-06-2020, В Вологодской области готовятся ко второму этапу снятия ограничений 
03-06-2020, Удмуртия получит 157 млн рублей на поддержку малого и среднего бизнеса 
03-06-2020, Воробьев рассказал о распространении COVID-19 в Подмосковье 
03-06-2020, Росрезерв показал неэффективность в период коронавируса, заявил Борисов 
03-06-2020, Мантуров предложил создать резерв масок на 15 миллиардов рублей 
03-06-2020, Путин поддержал идею создать резерв средств индивидуальной защиты 
03-06-2020, Экваториальная Гвинея отложила два нефтяных проекта из-за коронавируса 
03-06-2020, В России доля отечественных медицинских изделий достигла 91% 
03-06-2020, BlaBlaCar возобновляет работу в России, приостановленную из-за COVID-19 
03-06-2020, Сети отелей не вошли в число системообразующих, но им нужна помощь 
03-06-2020, Министр Экваториальной Гвинеи назвал ключевые факторы для нефтяного рынка 
03-06-2020, Путин отметил гибкий подход компаний к производству масок и перчаток 
03-06-2020, Путин отметил необходимость сохранить доходы россиян 
03-06-2020, Мишустин попросил доработать проект плана восстановления экономики 
03-06-2020, Денис Мантуров: сделаем все, чтобы к концу года получить вакцину от COVID 
03-06-2020, ВОЗ оценила ситуацию с коронавирусом в России и на Украине 
03-06-2020, В России третий день снижается суточный прирост заболевших COVID-19 
03-06-2020, Covindex за прошлую неделю снизился на 0,2 пункта 
03-06-2020, Ростуризм проработает алгоритмы поддержки небольших гостиниц 
03-06-2020, Власти Москвы выделили более 15 млрд рублей на гранты гостиницам и кафе 
03-06-2020, В АТОР попросили власти Москвы снизить налоговую нагрузку на туротрасль 
03-06-2020, Минэкономразвития подготовит дополнительные меры поддержки общепита РФ 
03-06-2020, СМИ: треть компаний планируют оптимизировать штат 
02-06-2020, По шкале не сошлись. Польша не открыла границу Прибалтике 
02-06-2020, Глава Адыгеи поставил задачи по развитию сельских территорий 
02-06-2020, Власти Москвы рекомендуют компаниям заранее готовиться к открытию 
02-06-2020, Watcom Group рассказала о посещаемости ТЦ Москвы в первый день открытия 
02-06-2020, План восстановления экономики предполагает стимулирование инвестиций 
02-06-2020, Челябинские власти довели до малого бизнеса поддержку на 720 млн рублей 
02-06-2020, Корпорация МСП рассказала бизнесменам о мерах поддержки при пандемии 
02-06-2020, Мишустин рассказал о плане восстановления экономики 
02-06-2020, Путин поручил Мишустину подготовить уточнения по реализации нацпроектов 
02-06-2020, Нацплан по экономике предполагает упрощение корпоративных отношений 
02-06-2020, В три этапа. Мишустин озвучил план по восстановлению экономики 
02-06-2020, Мишустин представил план по восстановлению экономики 
02-06-2020, Мишустин спрогнозировал рост российской экономики 
02-06-2020, Мишустин назвал стоимость плана восстановления экономики 
02-06-2020, Путин: ситуация с COVID-19 оказала серьезное влияние на все сферы жизни 
02-06-2020, Ограничения по COVID-19 готовы смягчить 35 регионов 
02-06-2020, Противовирусные меры не должны быть универсальным форс-мажором для всех 
02-06-2020, Песков оценил ситуацию со снятием ограничений по коронавирусу в регионах 
02-06-2020, Снова в рейс: господдержка помогла выжить транспортному бизнесу в Перми 
02-06-2020, На поддержку бизнеса и населения выделили более двух триллионов рублей 
02-06-2020, Совфед одобрил закон о мерах налоговой поддержки граждан, бизнеса и НКО 
02-06-2020, Малый и средний бизнес Москвы получит 288 миллионов рублей субсидий 
02-06-2020, В Приморье исчезли очереди из грузовиков перед пунктами пропуска с Китаем 
02-06-2020, Глава Уральских авиалиний назвал сроки возобновления полетов за рубеж 
02-06-2020, В Подмосковье могут закончиться дорогие коттеджи, опасаются риелторы  
02-06-2020, В ПСБ заявили о снижении атак мошенников на банковских клиентов 
01-06-2020, Вкусвилл приостановил открытие новых магазинов 
01-06-2020, ЕР предложила расширить перечень пострадавших от COVID-19 промпредприятий 
01-06-2020, Регионы не отказываются от заказов на ИВЛ Авента-М, заявил Мантуров 
01-06-2020, В Подмосковье могут открыть торговые центры 
01-06-2020, Систему здравоохранения России оснастили аппаратами ИВЛ, заявил Мантуров 
01-06-2020, Путин: продукция Сухого вызывает определенную дрожь у конкурентов 
01-06-2020, На Белопорожской ГЭС в Карелии после вспышки коронавируса сменят вахту 
01-06-2020, Россия не планирует больше закупать маски в Китае 
01-06-2020, Минпромторг считает возможным сформировать постоянный запас СИЗ в России 
01-06-2020, Спасибо новым мощностям. РФ прекратит закупку медицинских масок из Китая 
01-06-2020, В Мордовии пострадавшим от пандемии отраслям выделили 3,9 млрд рублей 
01-06-2020, Россияне покупают около 3,5 миллиона масок в сутки, сообщил Мантуров 
01-06-2020, Мантуров пообещал нарастить производство масок до 12 миллионов в сутки 
01-06-2020, Власти: АПК Мордовии показал уверенный рост даже в условиях пандемии 
01-06-2020, В Минпромторге заявили о снижении цен на маски в России 
01-06-2020, Богатейшие россияне с начала года потеряли более 31 миллиарда долларов 
01-06-2020, Ситуация с коронавирусом в России стабилизируется, заявил Мишустин 
01-06-2020, Большинство ритейлеров России ожидают закрытия до 30% салонов связи 
01-06-2020, Inventive Retail Group восстановила работу 115 магазинов в Москве 
01-06-2020, Путин поручил рассмотреть меры поддержки компаний из-за простоя вагонов 
01-06-2020, М.Видео-Эльдорадо открыло часть своих магазинов в Москве и регионах 
01-06-2020, Мишустин сообщил, что национальный план по экономике готов 
01-06-2020, Россия может стать экспортером препарата против COVID-19 
01-06-2020, Путин поручил подготовить меры по восстановлению внутреннего туризма 
01-06-2020, Эксперты: ввод офисов в Москве в 2020 году может упасть почти вдвое 
01-06-2020, Путин поручил представить предложения по компенсациям лизингодателям 
01-06-2020, Путин поручил выделить круизным компаниям компенсации по лизингу 
01-06-2020, Путин поручил расширить список отраслей, пострадавших от COVID-19 
01-06-2020, Эксперты: ввод торговой недвижимости в Москве в 2020 году упадет на 35% 
01-06-2020, На Чаяндинском месторождении сняли карантин по коронавирусу 
01-06-2020, Доберутся до дома. Стали известны детали о вывозном рейсе из Испании 
01-06-2020, Эксперт: Россия сыграет особую роль для экономики мира после пандемии 
31-05-2020, Попова исключила одномоментное снятие ограничений 
31-05-2020, Депутат Рады заявила о потребности Украины в российском рынке 
30-05-2020, Мурашко: реанимационные койки для пациентов с COVID задействовали на 10% 
30-05-2020, Путин: надо понять, как работать после снятия  ограничений по COVID-19 
30-05-2020, Россия потратит на борьбу с коронавирусом около 500 миллиардов рублей 
30-05-2020, Росавиация готова оперативно рассмотреть заявки аэропортов на субсидии  
30-05-2020, Минкомсвязь опубликовала расписание вывозных рейсов до 11 июня 
30-05-2020, На Украине число случаев COVID-19 выросло до 23 204 
29-05-2020, Норма меняется. Эксперт рассказал о глобальных изменениях из-за COVID 
29-05-2020, Власти Кубани сохранят финансирование АПК в полном объеме 
29-05-2020, Голикова назвала коэффициент распространения коронавируса в России 
29-05-2020, Спеклись. Какие рестораны не откроются после пандемии? 
29-05-2020, Лувр готовится к открытию в начале июля 
29-05-2020, В Подмосковье с 3 июня могут возобновить работу парикмахерские 
29-05-2020, Путин обсудит включение ювелирной отрасли в список пострадавших 
29-05-2020, Эксперт назвал факторы восстановления мировой торговли 
29-05-2020, Рестораторы обсуждают с властями Москвы открытие летних веранд 15 июня 
29-05-2020, В Новосибирске начали производить мороженое со вкусом гречки 
29-05-2020, В Москве 1 июня откроются более 56 тысяч предприятий 
29-05-2020, В ЕК назвали меры по предотвращению волны банкротств и увольнений в ЕС 
29-05-2020, Мишустин призвал использовать лучшие практики СССР для борьбы с COVID-19 
29-05-2020, Волин объяснил включение СМИ в перечень пострадавших отраслей 
29-05-2020, В СЖР прокомментировали включение СМИ в список пострадавших отраслей 
29-05-2020, В ЕК оценили ситуацию с инвестициями в Евросоюзе 
29-05-2020, Мишустин оценил влияние COVID-19 на экономику СНГ 
29-05-2020, Россия поставит партнерам тесты для миллиона исследований на COVID-19 
29-05-2020, Мишустин заявил, что ситуация с коронавирусом стабилизируется 
29-05-2020, Министр экономики Бурятии извинилась за фразу с голоду никто не умер 
29-05-2020, В ЕК оценили влияние коронавируса на ситуацию с инвестициями в ЕС 
