29-04-2020, Путин назвал беспрецедентной ситуацию на глобальном энергорынке 
29-04-2020, На Украине разрешили работу продуктовых рынков во время карантина 
29-04-2020, Власти Москвы рассказали о порядке продления пропусков 
29-04-2020, В России утвердили правила работы организаций, применяющих вахтовый метод 
29-04-2020, Назначенный на 1 мая вывозной рейс Камрань-Владивосток отменен 
29-04-2020, Минстрой подготовил меры поддержки поставщиков ресурсов ЖКХ 
29-04-2020, В России заразились коронавирусом менее 0,1% населения 
29-04-2020, Сбербанк отметил существенный переток клиентов в онлайн 
29-04-2020, Мишустин поручил разработать план по восстановлению роста экономики  
29-04-2020, Мишустин попросил МЭР до 5 мая обобщить идеи по мерам поддержки экономики 
29-04-2020, ОЭК: энергетики Москвы продолжают работать в штатном режиме 
29-04-2020, Якушев: в регионах по госпрограмме строят 177 объектов инфраструктуры 
29-04-2020, В Европе зафиксированы рекордные инвестиции в недвижимость 
29-04-2020, Пекин понизит наивысший уровень реагирования на ЧС 
29-04-2020, Омбудсмен по стройке призвал пересмотреть список системных компаний РФ 
29-04-2020, В Дубае озвучили примерную дату открытия страны для туристов 
29-04-2020, В Москве более 84% новых заболевших COVID-19 младше 65 лет 
29-04-2020, Аксенов рассказал, кого из приезжающих в Крым будут помещать в обсерватор 
29-04-2020, Арендаторы торговых точек в метро получат поддержку города 
29-04-2020, Магнит пересмотрит планы по открытию магазинов на фоне коронавируса 
29-04-2020, Новак назвал срок стабилизации цен на нефть 
29-04-2020, Продажи легковых машин в России могут упасть на треть 
29-04-2020, Трамп приравнял мясокомбинаты к оборонным предприятиям 
29-04-2020, Россияне в апреле побили рекорд 2020 года по оплате онлайн-курсов 
29-04-2020, Fitch понизило рейтинг Италии до BBB- 
28-04-2020, ЕР подготовит предложения по поэтапному выходу экономики из карантина 
28-04-2020, Глава Минтруда рассказал об окне возможностей в ситуации с COVID-19 
28-04-2020, В Петербурге продлили режим ограничений 
28-04-2020, В Газпроме заявили о плановой подаче газа в Силу Сибири 
28-04-2020, Путин заявил о недопустимости человеческих жертв в пользу экономики 
28-04-2020, Путин заявил о дальнейшей работе по борьбе с коронавирусом 
28-04-2020, Попова: в России один из самых низких уровней летальности по COVID-19 
28-04-2020, Попова заявила о снижении прироста COVID-19 в России в 3,5 раза 
28-04-2020, Русские горки: как не скатиться в бедность на карантине 
28-04-2020, Путин рассказал о выделенных ресурсах на поддержку экономики  
28-04-2020, Глава ТПП предложил создать резерв средств индивидуальной защиты 
28-04-2020, Путин определил главную задачу плана действий в условиях коронавируса 
28-04-2020, Путин поручил подготовить план по нормализации доходов и роста экономики 
28-04-2020, Путин отметил экономические последствия эпидемии 
28-04-2020, Путин поручил подготовить рекомендации по снятию ограничений с 12 мая 
28-04-2020, Путин поручил создать новый план поддержки предпринимателей 
28-04-2020, Путин: у регионов должно сохраняться пространство для маневра 
28-04-2020, Путин: говорить об одномоментной отмене ограничений по COVID-19 нельзя 
28-04-2020, Путин: пик по коронавирусу в России еще не пройден 
28-04-2020, Путин отметил наращивание запаса прочности системы здравоохранения  
28-04-2020, Эксперты ждут существенного падения рынка гостиниц Москвы и Петербурга 
28-04-2020, Путин поручил наращивать производство товаров для борьбы с COVID-19 
28-04-2020, Путин рассказал об увеличении числа аппаратов ИВЛ в России 
28-04-2020, Путин рассказал о развертывании производства целого ряда лекарств 
28-04-2020, Путин заявил, что удалось мобилизовать ресурсы промышленности 
28-04-2020, Пассажиропоток российских авиакомпаний в марте упал на 28,1% 
28-04-2020, В Калужской области умерли четыре пациента с COVID-19 
28-04-2020, Топ-менеджеры Яндекса сократили зарплаты и отказались от премий 
28-04-2020, Эксперты: Дом.РФ поддержит выкупом квартир региональных застройщиков 
28-04-2020, Набиуллина назвала суммы, выделенные на кредиты бизнесу для зарплат 
28-04-2020, Медорганизациям рекомендовали снизить потребность в средствах защиты 
28-04-2020, Российские банки стали более осторожными в выдаче новых кредитов 
28-04-2020, Набиуллина призвала расширить механизмы прямой господдержки 
28-04-2020, ADG Group перенесла открытие шести ТЦ в Москве на вторую половину лета 
28-04-2020, ТПП предлагает запретить отключение отелей от сетей снабжения ресурсами 
28-04-2020, В Аэрофлоте рассказали, где стоят приземленные из-за пандемии самолеты 
28-04-2020, Причину спада в продажах антисептиков нашли в привычках россиян 
28-04-2020, Хуснуллин: выделенные деньги должны помочь отстающим регионам 
28-04-2020, В Кремле считают, что прогнозы о рисках для среднего класса вряд ли верны 
28-04-2020, Россияне увеличили потребление газа из-за самоизоляции, заявил Новак 
28-04-2020, В Белоруссии за сутки число случаев коронавируса выросло на 919 
28-04-2020, Хуснуллин: пандемия поднимет культуру производства на стройках 
28-04-2020, В Новосибирской области снизилась собираемость платежей за электричество 
28-04-2020, Эксперт оценил потери итало-российского бизнеса из-за коронавируса 
28-04-2020, Хуснуллин: падение спроса на жилье в регионах достигает 75% 
28-04-2020, В России провели более 3,1 миллиона тестов на коронавирус 
28-04-2020, Дом.РФ хочет направить на выкуп квартир у девелоперов 150 млрд рублей 
28-04-2020, Власти Москвы расширили перечень получателей субсидии для франчайзи 
28-04-2020, Более 5,8 тысячи представителей МСП смогут не платить аренду в Москве 
28-04-2020, Пункты пропуска через границу оборудуют тепловизорами 
28-04-2020, ТПП призвала переориентировать нацпроект по МСП на поддержку из-за COVID 
28-04-2020, В КНР число интернет-пользователей из-за пандемии превысило 900 миллионов 
28-04-2020, Трамп ждет быстрого роста экономики во втором полугодии 2020 года 
28-04-2020, Ректор ВШЭ предупредил о риске обеднения среднего класса 
27-04-2020, Число больных коронавирусом в мире превысило три миллиона человек 
27-04-2020, ЕК спрогнозировала падение ВВП еврозоны на 7,5%  
27-04-2020, Ространснадзор продлил приостановку весового контроля грузовых машин 
27-04-2020, Вирус не повлияет. Матвиенко оценила необходимость поправок в бюджет 
27-04-2020, Матвиенко: корректировка бюджета из-за коронавируса не требуется 
27-04-2020, Матвиенко оценила устойчивость российской финансовой системы 
27-04-2020, Ростуризм сообщил, что субсидии возместят только часть убытков бизнеса 
27-04-2020, ЮТэйр планировала забрать 26 россиян с Фиджи  
27-04-2020, Ректор ВШЭ заявил о новой реальности в мировой экономике 
27-04-2020, АвтоВАЗ остановит производство с 29 апреля по 17 мая 
27-04-2020, Официальный курс евро на вторник вырос на 50,83 копейки 
27-04-2020, В Кремле раскрыли, как будет приниматься решение о продлении самоизоляции 
27-04-2020, Мишустин попросил глав регионов контролировать реализацию мер поддержки 
27-04-2020, В России вступил в силу второй пакет мер поддержки граждан и экономики 
27-04-2020, Уже третий пакет. Правительство разрабатывает новые антикризисные меры 
27-04-2020, В Кремле прокомментировали возможное продление режима самоизоляции 
27-04-2020, Мишустин поручил вести мониторинг доведения средств на борьбу с COVID-19 
27-04-2020, Онлайн-платформу Антивирусное предложение внедрили в ОЭЗ Москвы 
27-04-2020, Путин поручил выделить регионам помощь на поддержку граждан и предприятий 
27-04-2020, В России могут расширить перечень системообразующих предприятий 
27-04-2020, Эксперт ВШЭ: Москва прошла пик заболеваемости COVID-19 три дня назад 
27-04-2020, Просрочка в пандемию. Что магазинам делать с продуктами? 
27-04-2020, Правительство готовит третий пакет мер поддержки экономики 
27-04-2020, В Китае 600 тысяч выпускников рискуют не трудоустроиться из-за COVID 
27-04-2020, Правительство утвердило порядок предоставления субсидий бизнесу 
27-04-2020, Мишустин поручил подготовить план по поэтапной отмене ограничений для ИП 
27-04-2020, Песков отметил важность поддержки крупного бизнеса 
27-04-2020, Песков спрогнозировал скорый выход России на плато по коронавирусу  
27-04-2020, Очные саммиты глав государств никуда не денутся, заявил Песков 
27-04-2020, Песков прокомментировал перенос сроков сдачи деклараций о доходах 
27-04-2020, В России провели более трех миллионов тестов на коронавирус 
27-04-2020, Ъ: Минкомсвязь согласилась отложить введение части норм закона Яровой 
27-04-2020, Структура АФК Система купит отели с проблемами из-за коронавируса 
27-04-2020, Более 80 россиян вернутся из Афин в Москву вывозным рейсом 
27-04-2020, В РЖД не ждут фатальных исходов для компании из-за COVID-19 
27-04-2020, Ъ: Минтранс попросил у Мишустина о многомиллиардной поддержке 
27-04-2020, Аврора планирует 30 апреля вывозной рейс из Шанхая во Владивосток 
27-04-2020, В РЖД сообщили о вероятности введения неполной занятости из-за пандемии 
27-04-2020, Коллапс рынка труда: CША предрекли Великую депрессию — 2  
27-04-2020, В Русале оценили последствия вспышки COVID-19 для рынка алюминия 
27-04-2020, В Калуге возобновит производство завод Volkswagen  
26-04-2020, Белоруссия рассчитывает на внешнюю поддержку в борьбе с пандемией 
26-04-2020, Минфин готов поддерживать россиян в случае продления эпидемии 
26-04-2020, Оклахома попросила Трампа объявить COVID-19 стихийным бедствием 
26-04-2020, Правительство утвердило правила возмещения затрат туроператорам 
26-04-2020, В минфине США надеются на быстрое восстановление экономики после июля 
26-04-2020, Сотрудники российских банков переедут на работу 
26-04-2020, Песков рассказал о будущем автопрома в период коронавируса 
26-04-2020, В Югре умер второй пациент с коронавирусом 
26-04-2020, Попова заявила о сокращении темпов прироста коронавируса в России 
26-04-2020, В Белоруссии число заразившихся COVID-19 выросло до 10463 
26-04-2020, Кудрин предложил оказывать продовольственную помощь самым бедным  
26-04-2020, Жить в офисе. Банки предложили сотрудникам необычно переждать пандемию 
26-04-2020, Кудрин спрогнозировал падение российской экономики до 7-8% 
26-04-2020, Кудрин спрогнозировал восстановление российской экономики 
26-04-2020, Росстат рассказал о сокращении реальных располагаемых доходов россиян 
26-04-2020, В НАО выявили девять случаев заражения COVID-19 на месторождении 
26-04-2020, Росстат сообщил о снижении реальных располагаемых доходов россиян на 0,2% 
26-04-2020, В России подготовят поэтапную отмену ограничений для бизнеса 
25-04-2020, Орешкин назвал приоритеты мер поддержки 
25-04-2020, Орешкин предрек замедление глобализации после пандемии коронавируса 
25-04-2020, Помощник Путина дал прогноз о том, как Россия пройдет кризис 
25-04-2020, Число случаев COVID-19 в мире возросло до 2,7 миллиона 
25-04-2020, Мишустин поручил проработать поэтапную отмену ограничений для бизнеса 
25-04-2020, Минэкономразвития представит макропрогноз по ситуации в России в мае 
25-04-2020, СР на встрече с Набиуллиной обсудит выделение допсредств населению 
25-04-2020, Мощнейший удар. Глава Аэрофлота о том, как страдает отрасль из-за COVID 
25-04-2020, Банковский сектор закончит 2020 год с убытком, считает Греф 
25-04-2020, Аэрофлот переориентировал часть самолетов на грузовые перевозки 
25-04-2020, Более 40 процентов персонала Аэрофлота находится в отпусках 
25-04-2020, Скупость ни к чему. Кудрин отметил, как нужно спасать граждан в пандемию 
25-04-2020, Глава Аэрофлота рассказал, когда компания восстановится после пандемии 
25-04-2020, Соцобязательства бюджета оплатят в любом случае, заявил Силуанов 
25-04-2020, Греф рассказал, во сколько обойдется реструктуризация кредитов физлиц 
25-04-2020, Кудрин призвал власти не скупиться на борьбу с кризисом в 2020 году 
25-04-2020, Кудрин предложил ввести продовольственные выплаты на период эпидемии 
25-04-2020, Алекперов рассказал, при какой цене на нефть может работать Лукойл 
25-04-2020, Бизнесмены могут направить в Роспотребнадзор идеи по работе при пандемии 
25-04-2020, Мишустин утвердил дополнительную отсрочку по страховым взносам для МСП 
25-04-2020, Правительство одобрило ряд проектов по поддержке россиян и экономики 
25-04-2020, Российские банки адаптируются к взрывному росту бесконтактных платежей 
24-04-2020, Минкомсвязь обновила перечень системообразующих организаций в сфере ИКТ 
24-04-2020, Голикова доложит Путину и Мишустину об идеях о продлении ограничений 
24-04-2020, Попова заявила, что выход из самоизоляции должен быть поэтапным 
24-04-2020, Трамп подписал закон о дополнительном стимулировании экономики 
24-04-2020, Титов призвал постепенно открывать торговые центры по всей России 
24-04-2020, Болгария отложила тендер по выбору инвестора для АЭС Белене 
24-04-2020, В Минэкономразвития оценили потери экономики из-за коронавируса 
24-04-2020, Глава ЦБ назвала основные причины отказа россиянам в кредитных каникулах  
24-04-2020, Глава ФНС объяснил, почему остановлены не все проверки бизнеса 
24-04-2020, ФНС разъяснила сроки подачи деклараций в связи с коронавирусом 
24-04-2020, Утвержден список системообразующих организаций в строительстве и ЖКХ 
24-04-2020, Госкомпания Автодор стала системообразующим предприятием РФ 
24-04-2020, Бюджет Ростовской области скорректировали с учетом пандемии коронавируса 
24-04-2020, МВФ и ВТО обеспокоены ростом торговых ограничений на фоне коронавируса 
24-04-2020, Авиакомпании стали массово отменять внутренние рейсы 
24-04-2020, Риелторы: снижение ставки ЦБ компенсирует падение спроса на жилье 
24-04-2020, Медведев направил Мишустину предложения по поддержке бизнеса и НКО 
24-04-2020, Путин призвал обеспечить стабильную работу автоотрасли 
24-04-2020, Путин поручил направить пять миллиардов рублей на закупку машин скорой  
24-04-2020, Путин поручил подумать о переносе уплаты автоконцернами утильсбора 
24-04-2020, Путин: автодилеры одними из первых заработают после снятия ограничений 
24-04-2020, Путин сравнил ситуацию с COVID-19 и финансовый кризис 2008-2009 годов 
24-04-2020, Предложения по поддержке автопрома будут озвучены в пятницу, заявил Путин 
24-04-2020, Автопрому нужно подставить плечо в условиях коронавируса, заявил Путин 
24-04-2020, Путин отметил необходимость определить параметры поддержки автопрома 
24-04-2020, Власти выделили 5,2 миллиарда рублей на закупку 1200 реанимобилей 
24-04-2020, Путин призвал обеспечить работу автопрома 
24-04-2020, Многие компании одномоментно оказались в жестких условиях, заявил Путин 
24-04-2020, Матвиенко: у России достаточно финансовых ресурсов для борьбы с COVID-19 
24-04-2020, Рубль отреагировал ростом на решение понизить ключевую ставку 
24-04-2020, Путин проведет совещание по ситуации в автопроме 
24-04-2020, Эксперт предсказал ЕС длительную рецессию после кризиса из-за COVID-19 
24-04-2020, Wizz Air планирует возобновить полеты из Вены в начале мая 
24-04-2020, Онищенко предложил открыть ряд предприятий МСП уже сейчас  
24-04-2020, НАФИ: 60% российских предпринимателей уже имеют просрочки по аренде 
24-04-2020, Дивный новый мир: кто и где легче переживет кризис? 
