14-12-2020, Мишустин продлил программы поддержки аэропортов и авиакомпаний 
14-12-2020, Московские власти оценили влияние пандемии на экономику 
14-12-2020, В России утвердили правила выдачи субсидий на разработку вакцины от COVID 
12-12-2020, Эксперт рассказал, когда начнется восстановление российской экономики 
12-12-2020, Рынок делает ставки. Saxo Bank спрогнозировал окончание пандемии 
12-12-2020, В Saxo Bank предсказали, когда закончится пандемия COVID-19 
11-12-2020, Минпромторг оценил темпы производства вакцины Спутник V 
11-12-2020, Москва станет крупнейшей площадкой по выпуску вакцины от COVID-19 
10-12-2020, Россия и Белоруссия будут совместно исследовать COVID-19 у животных 
10-12-2020, Москалькова назвала число обанкротившихся за время пандемии предприятий 
09-12-2020, Аналитики ЦБ рассказали, как изменились привычки россиян из-за COVID-19 
09-12-2020, Мишустин рассказал, что ждут россияне от правительства во время пандемии 
08-12-2020, Saxo Bank опубликовал шокирующие прогнозы на 2021 год 
07-12-2020, Цена на нефть идет вниз на фоне роста заболеваемости COVID-19 
04-12-2020, РФПИ договорился с Казахстаном о регистрации вакцины Спутник V 
04-12-2020, В Молдавии ожидают рекордное снижение ВВП по итогам года 
02-12-2020, В мире будут производить минимум 30 миллионов доз Спутник V в месяц 
02-12-2020, РФПИ подал заявки на одобрение вакцины Спутник V регуляторам 40 стран 
01-12-2020, Bloomberg: в Азию направится армада из танкеров с американской нефтью 
01-12-2020, Аэрофлот надеется на восстановление авиасообщения с апреля 
01-12-2020, Решетников рассказал, как крупный российский бизнес переживает пандемию 
01-12-2020, Выплаты, кредиты, больничный: что изменится с 1 декабря  
01-12-2020, Собственные доходы Сургутского района ХМАО на фоне пандемии выросли на 9% 
30-11-2020, Кубань увеличила производство бактерицидных рециркуляторов воздуха 
30-11-2020, Мишустин назвал коронавирус стресс-тестом для всех стран 
30-11-2020, В Кремле оценили возможность дополнительной помощи бизнесу из-за пандемии 
30-11-2020, РФПИ и Химрар удвоили производство препарата от COVID-19 Авифавир 
27-11-2020, В Венгрии назвали сроки поставок российской вакцины 
27-11-2020, Россия проходит пандемию без разрушительных локдаунов, заявила Матвиенко 
27-11-2020, В Индии произведут более ста миллионов доз вакцины Спутник V 
26-11-2020, Собянин рассказал о принимаемых в Москве ограничениях из-за COVID-19  
26-11-2020, На хлебе и воде: сколько еще придется экономить из-за пандемии 
26-11-2020, Песков ответил на вопрос о закупках оборудования для вакцины от COVID-19 
26-11-2020, Эфиопия поддержит производство вакцины Спутник V на своей территории 
26-11-2020, Путин поручил доложить об участии РСПП в совете по COVID-19 
25-11-2020, В Британии заявили о сильнейшем за 300 лет кризисе 
25-11-2020, Экономисты рассказали, что поможет России предотвратить новый локдаун 
25-11-2020, Агентство ЕС по лекарствам начало переговоры с производителем Спутник V 
25-11-2020, Оперштаб назвал регион с наименьшим темпом прироста случаев COVID-19 
25-11-2020, Большинство отраслей экономики Москвы восстановились, заявил заммэра 
25-11-2020, Covindex снизился впервые с начала октября 
24-11-2020, Россия подала заявку на регистрацию вакцины Спутник V в Европе 
23-11-2020, Акции AstraZeneca упали почти на 2% после данных об эффективности вакцины 
20-11-2020, Минфин направил в регионы финансовую помощь из-за пандемии 
20-11-2020, Сбер назвал города с самым высоким риском заражения коронавирусом 
20-11-2020, Сбер оценил влияние второй волны коронавируса на зарплаты россиян 
20-11-2020, Фондовый рынок США на грани обвала 
19-11-2020, Минпромторг проконтролирует выпуск дополнительных лекарств 
19-11-2020, Страхование: как выбрать полис и не быть обманутым 
18-11-2020, Минпромторг и Минздрав определили перечень лекарств для госрезерва 
18-11-2020, Пандемия увеличила спрос на части диких животных в Азии, заявил эксперт 
18-11-2020, Зеленая энергия ослабила нефть: когда обрушится рынок черного золота 
17-11-2020, Расходы россиян за прошедшую неделю стали рекордными с конца марта 
17-11-2020, БРИКС зарезервировал десять миллиардов долларов на борьбу с пандемией 
17-11-2020, Аналитики предположили, из-за чего доллар может рухнуть в 2021 году 
17-11-2020, Аналитики предсказали падение курса доллара на 20% 
12-11-2020, Для части компаний налоговые каникулы продлят на три месяца 
12-11-2020, Производители Спутник V в России перешли на реакторы большого объема 
12-11-2020, Губернатор Сахалина попросил помощи в устранении последствий пандемии 
12-11-2020, Эксперт рассказал, ждать ли реальных скидок в сезон распродаж 
11-11-2020, Глава АСИ оценила влияние вакцинации от коронавируса на экономику 
11-11-2020, Белоусов оценил расходы бюджета, связанные с COVID-19 
11-11-2020, Коронавирус отбросил Россию на полтора года назад, заявил Белоусов 
10-11-2020, Губернатор Рязанской области рассказал о помощи от Минэкономразвития 
10-11-2020, Титов предложил компенсировать бизнесу убытки от новых ограничений 
09-11-2020, Цены на нефть взлетели на новостях о вакцине от COVID-19 
09-11-2020, Россельхознадзор объяснил следы коронавируса на упаковке рыбы для Китая 
09-11-2020, Мантуров призвал воздержаться от запретов на работу общепита и магазинов 
09-11-2020, Минпромторг не видит необходимости в новых ограничениях для магазинов 
09-11-2020, России грозит дефицит автомобилей: насколько вырастут цены 
07-11-2020, Российским компаниям продлили срок исполнения инновационных проектов 
06-11-2020, Мишустин назвал факторы, влияющие на экономическую активность в СНГ 
06-11-2020, В Biocad назвали срок передачи на производство технологий по Спутник V 
04-11-2020, COVID, политика и экономика: Кремль о деталях беседы Путина и Лукашенко 
03-11-2020, Оперштаб назвал регионы с наименьшими темпами прироста случаев COVID-19 
01-11-2020, Закроет всех на годы. Трамп допустил бесконечный локдаун при Байдене 
31-10-2020, Россияне стали лучше платить плохие долги, считают коллекторы 
30-10-2020, Экономист предложил использовать букву К для прогноза после пандемии 
30-10-2020, В Минцифры оценили влияние пандемии на темпы цифровизации в России 
30-10-2020, Производитель Арепливира начал регистрацию препарата в Чили 
30-10-2020, Минпромторг рекомендовал увеличить выпуск антибиотиков 
30-10-2020, Инвестор оценил масштаб экономического кризиса в условиях пандемии 
30-10-2020, Производитель готов выпускать до миллиона упаковок Арепливира в месяц 
30-10-2020, В российских аптеках рекордно возросли продажи 
29-10-2020, Титов предложил налоговую амнистию для малого бизнеса из-за COVID-19 
29-10-2020, ВТБ Капитал оценил состояние долгового рынка в России 
29-10-2020, Коронавирус, ипотека, инвестиции. Путин выступил на форуме Россия зовет 
29-10-2020, Россия готова производить вакцину от COVID-19 на зарубежных площадках 
29-10-2020, Четко понимаем. Путин разъяснил, будет ли вводиться локдаун из-за COVID 
29-10-2020, Путин заявил, что отсрочка по кредитам бизнесу не нанесла вреда банкам 
29-10-2020, Путин назвал объем средств бюджета, направленных на борьбу с пандемией 
29-10-2020, Путин предложил продлить налоговые отсрочки для компаний общепита 
29-10-2020, Путин: России удалось не допустить всплеска инфляции во время пандемии 
29-10-2020, Путин оценил принятые в России меры по COVID-19 
29-10-2020, Путин рассказал о влиянии пандемии на развитие экономики 
29-10-2020, Решетников оценил влияние COVID-19 на экономику России  
29-10-2020, Владимир Путин выступает на форуме Россия зовет. Трансляция 
29-10-2020, РЖД продлили удаленку для сотрудников до 2021 года 
29-10-2020, В Госдуме предложили временно отменить комиссии за банковские переводы 
28-10-2020, Греф оценил работу Центрального банка в период пандемии 
28-10-2020, Рябков осудил попытки политизировать тему СOVID-19 
28-10-2020, Счетная палата озвучила шоковый сценарий из-за пандемии 
28-10-2020, Счетная палата назвала данные по спаду ВВП статистическим феноменом 
28-10-2020, Счетная палата составила шоковый сценарий для российской экономики 
28-10-2020, Китай приостановил прием грузов с трех российских судов из-за COVID-19 
27-10-2020, Аналитик оценил состояние экономики России в условиях пандемии  
27-10-2020, В Moodys оценили устойчивость России к потрясениям на фоне пандемии 
26-10-2020, Ряд принятых в пандемию решений продолжат действовать, заявил Мишустин 
24-10-2020, Глава AmCham оценил падение ВВП России и США 
23-10-2020, Собянин оценил влияние ограничительных мер на экономику 
23-10-2020, Якутии предоставят дополнительное оборудование для борьбы с COVID-19 
22-10-2020, Путин заявил о необходимости скорректировать поддержку отдельных отраслей 
22-10-2020, Credit Suisse оценил обеднение россиян в пандемию 
22-10-2020, Сечин призвал использовать опыт Китая в борьбе с коронавирусом 
22-10-2020, РБК: авиакомпании попросили у правительства 50 миллиардов рублей субсидий 
21-10-2020, Путин попросил бизнес соблюдать рекомендации из-за COVID-19 
21-10-2020, Бизнесмены попросили Путина не вводить новый карантин, пишет РБК 
21-10-2020, Путин назвал производство вакцины от коронавируса хорошим бизнесом 
21-10-2020, Эксперт рассказал, как Китай восстановил экономику во время пандемии 
21-10-2020, Путин назвал ключевой посыл в работе бизнеса в период пандемии 
21-10-2020, Путин: в период пандемии нужны слаженные действия бизнеса и государства 
21-10-2020, Путин не исключил новых проблем в мировой экономике из-за пандемии 
20-10-2020, Мишустин назвал задачу правительства в пандемию 
20-10-2020, В Москве не планируют закрывать промпредприятия  
20-10-2020, Московские власти рассказали о реализации бюджета из-за ситуации с COVID 
19-10-2020, Вакцину Спутник V могут поставить в страны Латинской Америки в декабре 
19-10-2020, России удалось сохранить макроэкономическую стабильность, заявил Мишустин 
19-10-2020, Песков отметил высокий спрос за рубежом на российскую вакцину от COVID-19 
19-10-2020, В Кремле назвали пандемию беспрецедентным вызовом 
19-10-2020, В России выделят еще 35 миллиардов рублей на поддержку безработных 
19-10-2020, Число выявленных случаев COVID-19 в мире превысило 40 миллионов 
19-10-2020, Оперштаб назвал регионы с наименьшим приростом по коронавирусу 
19-10-2020, В России выявили рекордное число новых случаев коронавируса 
19-10-2020, МВФ придумал, как спасти мир: России это угрожает нищетой 
18-10-2020, Немецкие СМИ оценили стоимость лечения COVID-19 
18-10-2020, В Китае впервые нашли живой вирус COVID-19 на упаковке охлажденной трески 
17-10-2020, Во Франции зафиксировали рекордный суточный прирост заболевших COVID-19 
17-10-2020, Оперштаб назвал регионы с наименьшими темпами прироста случаев COVID-19 
16-10-2020, Российский препарат от COVID-19 Арепливир перестали продавать за рубеж 
16-10-2020, Препарат от COVID-19 Арепливир поступил во все регионы России 
16-10-2020, Аналитики рассказали, что покупают россияне на фоне усиления пандемии 
16-10-2020, ФАС согласовала предельную цену на лекарство от COVID-19 Фавипиравир 
16-10-2020, Масок и перчаток в России хватит всем, заявили в Минпромторге 
15-10-2020, Попова попросила бизнес соблюдать правила по COVID-19 
15-10-2020, Глава Минздрава рассказал о преимуществах вакцины центра Вектор 
15-10-2020, Попова рассказала, какие штаммы коронавируса есть в России 
15-10-2020, Первая африканская страна может объявить дефолт из-за коронавируса 
15-10-2020, Число российских школ на карантине из-за COVID-19 достигло 115 
15-10-2020, Вирусологи ответили на вопрос о выходе на плато по коронавирусу в России 
15-10-2020, Оперштаб назвал регионы с наименьшими темпами прироста случаев COVID-19 
14-10-2020, Минздрав рассказал о гражданском обороте вакцины Вектора от COVID-19 
14-10-2020, МВФ посчитал, во что пандемия коронавируса обойдется миру 
14-10-2020, Путин призвал наладить выпуск вакцины для других стран на их мощностях 
14-10-2020, Правительство пересмотрит цены на препараты от коронавируса 
14-10-2020, Россия планирует весной выпускать 15 млн доз вакцины Спутник V в месяц 
14-10-2020, Цены на лекарства на основе фавипиравира упали более чем в два раза 
14-10-2020, Вирусолог рассказал, как долго школьникам лучше учиться на дистанционке 
14-10-2020, Четыре российские компании работают над производством вакцины от COVID-19 
14-10-2020, Мурашко оценил число крайне тяжело больных пациентов с COVID-19 в России 
13-10-2020, Эквадор изучает возможность импорта российской вакцины Спутник V 
13-10-2020, Роспотребнадзор не видит смысла блокировать экономику из-за коронавируса 
13-10-2020, Китай запретил на месяц рейс Аэрофлота в Шанхай из-за COVID-19 
13-10-2020, Выделено пять стадий потребления во время коронавируса в России 
12-10-2020, В РФПИ допустили поставку Спутника V из других стран в Россию  
12-10-2020, Швейцарская авиакомпания не будет сокращать число рейсов в Россию 
12-10-2020, РЖД переведет на удаленку максимально возможное число сотрудников 
12-10-2020, В Москве выписали более двух тысяч штрафов за несоблюдение мер по COVID 
12-10-2020, Названы регионы с наименьшим приростом по коронавирусу 
12-10-2020, В России за сутки выявили 13 592 случая заражения коронавирусом 
11-10-2020, Вирусолог рассказал, когда ждать пика заболеваемости COVID-19 в России 
11-10-2020, Оперштаб назвал регионы с наименьшим темпом прироста по коронавирусу 
11-10-2020, В России впервые выявили более 13 тысяч случаев COVID-19 за сутки 
11-10-2020, Собянин объяснил, почему Москва не закрывает инвестиционные программы 
11-10-2020, Путин рассказал о работе АПК в условиях ограничений из-за COVID-19 
10-10-2020, Оперштаб назвал регионы с наименьшими темпами прироста случаев COVID-19 
10-10-2020, И вновь рекорд. В РФ второй день фиксируют свыше 12 тысяч случаев COVID 
10-10-2020, Россия ведет переговоры с Боливией о поставке вакцины Спутник V 
09-10-2020, Власти Москвы объяснили консультации с бизнесом 
09-10-2020, Правительство разрешило полеты за рубеж еще из четырех городов 
09-10-2020, Отельеры надеются на восстановление спроса в Москве не ранее лета 2022 г 
09-10-2020, Вирусолог спрогнозировал пик распространения COVID-19 в России 
08-10-2020, Титов призвал регионы не закрывать экономики из-за COVID-19 
08-10-2020, Трафик российских ТЦ и ресторанов снова начал падать, сообщил Минпромторг 
08-10-2020, Замглавы Минстроя: вторая волна COVID-19 не остановит стройки в России 
08-10-2020, Правительство выделило 6,5 миллиарда рублей на выплаты медикам 
08-10-2020, Бангладеш будет производить вакцину от COVID-19 самостоятельно 
08-10-2020, ЕС заключил третий контракт на потенциальную вакцину от коронавируса 
08-10-2020, Правительство выделит регионам допсредства на выплаты по коронавирусу 
08-10-2020, Омбудсмен надеется, что массового закрытия отелей Москвы удастся избежать 
08-10-2020, Оперштаб назвал регионы с наименьшими темпами прироста случаев COVID-19 
08-10-2020, Снова на самоизоляцию: насколько подорожают покупки в интернете  
08-10-2020, Эксперт назвал регионы с самым сильным падением трафика в ТЦ из-за COVID 
07-10-2020, Всемирный банк спрогнозировал рост числа крайне бедных из-за COVID-19 
07-10-2020, Риелторы: в Подмосковье из-за коронавируса снимают с продажи дома 
07-10-2020, В Кремле считают неверным сокращать поддержку малого и среднего бизнеса 
