07-04-2020, Сотрудники крупного завода на Урале получат допвыплаты из-за COVID-19 
07-04-2020, ЦБ предупредил о новых схемах мошенничества под предлогом коронавируса 
07-04-2020, S7 получила разрешения на три вывозных рейса из Таиланда и Японии 
07-04-2020, Александр Латкин: в борьбе с COVID-19 стоит учиться дисциплине у Китая 
07-04-2020, Эксперт рассказал о новых возможностях Китая после эпидемии COVID-19 
07-04-2020, Airbnb получит $1 млрд от частных инвесторов на фоне пандемии 
07-04-2020, Идеальный шторм: России предрекли двухлетнюю рецессию 
07-04-2020, До 10 тысяч приморцев могут остаться без работы после самоизоляции 
07-04-2020, Эксперт: участников fashion-рынка ждут разорения без господдержки 
07-04-2020, Минпромторг призвал обеспечить бесперебойную работу промпредприятий 
07-04-2020, Сотрудникам Северстали выплатят по 10 тысяч рублей из-за COVID-19 
07-04-2020, РЖД отменили десятки поездов из-за коронавируса 
06-04-2020, Камаз оценил потери за неделю простоя в два миллиарда рублей 
06-04-2020, Эксперты рассказали, сколько россиян смогут уйти на кредитные каникулы 
06-04-2020, Названо условие для получения кредитных каникул по ипотеке 
06-04-2020, В России утвердили меры по спасению экономики от коронавируса 
06-04-2020, Табачные компании возобновляют работу фабрик в России 
06-04-2020, Москвичей бояться – в Москву не ходить. Регионы испугались приезжих? 
06-04-2020, Мишустин оценил ситуацию с продуктами в магазинах 
06-04-2020, Эксперты обрисовали новую реальность рубля 
06-04-2020, На Ставрополье ослабят ограничительные меры из-за COVID-19 
06-04-2020, Эксперты подсчитали, сколько потеряет экономика РФ из-за пандемии 
06-04-2020, АвтоВАЗ изучает условия для возобновления производства 
06-04-2020, В Москве около 250 промышленных предприятий возобновили работу 
06-04-2020, Эксперт сравнил влияние COVID-19 на китайскую и американскую экономики 
06-04-2020, Соцпредприниматели смогут получить помощь в рамках акции Мы вместе 
06-04-2020, Акционеры USM выделят 2 млрд рублей на борьбу с коронавирусом в России 
06-04-2020, Пермский край ввел временные налоговые льготы для бизнеса 
06-04-2020, ФАС объяснила подорожание имбиря, лимонов и чеснока 
06-04-2020, Мишустин подписал постановление об отсрочках и рассрочках налогов 
06-04-2020, Как россиянам уйти на кредитные каникулы 
06-04-2020, Эксперт: влияние коронавируса на ипотеку проявится через два месяца 
06-04-2020, НБКИ: под ипотечные каникулы из-за коронавируса подпадает треть займов 
06-04-2020, Минтранс обсуждает возможность поддержки круизных компаний 
06-04-2020, Титов предложил налоговую амнистию для МСП на фоне коронавируса 
06-04-2020, Титов попросил Путина расширить список отраслей, пострадавших от COVID 
06-04-2020, Артем Седов: COVID-19 перераспределил мусор в России 
06-04-2020, Ростех будет отвечать за снабжение регионов масками и перчатками 
06-04-2020, Ракова назвала условие ужесточения мер по самоизоляции 
06-04-2020, В России зафиксирован ажиотажный спрос на жилье 
06-04-2020, Мишустин попросил подготовить допмеры для укрепления экономики 
06-04-2020, Группа ГАЗ частично возобновила производство 
06-04-2020, Мишустин: регионам выделили на борьбу с COVID-19 серьезные средства 
06-04-2020, В России определен максимальный размер кредита для получения отсрочки 
06-04-2020, В России утвердили максимальные размеры кредитов для получения каникул 
06-04-2020, Глава РФПИ выступил за возобновление бизнес-диалога России и США 
06-04-2020, Правительство утвердило список наиболее пострадавших от COVID отраслей 
06-04-2020, АвтоВАЗ не возобновит производство машин с 6 апреля из-за COVID-19 
06-04-2020, Утвержден список наиболее пострадавших от коронавируса отраслей 
06-04-2020, В Москве создадут рабочую группу для поддержки бизнеса 
06-04-2020, EMG получила заказы от 40 российских компаний на тесты на коронавирус 
06-04-2020, Малый и средний бизнес в Москве получит субсидии на онлайн-сервисы 
06-04-2020, РФПИ ожидает начала восстановления мировой экономики в следующем году 
06-04-2020, В Москве создадут рабочую группу для поддержки бизнеса 
06-04-2020, EMG получила заказы от 40 российских компаний на тесты на коронавирус 
06-04-2020, Малый и средний бизнес в Москве получит субсидии на онлайн-сервисы 
06-04-2020, РФПИ ожидает начала восстановления мировой экономики в следующем году 
06-04-2020, Цены на новостройки в России из-за коронавируса могут упасть на 30% 
05-04-2020, Плодоовощной союз попросил временно запретить импорт томатов в Россию 
05-04-2020, РЖД отменили последний международный прямой пассажирский поезд 
05-04-2020, Песков призвал готовиться к мировому кризису из-за коронавируса 
05-04-2020, Песков заявил о необходимости готовиться к мировому кризису 
05-04-2020, На Ямале продлили режим самоизоляции 
05-04-2020, Эксперт прокомментировал отмену пошлин на ввоз ряда товаров в ЕАЭС 
05-04-2020, Белоруссия отменяет последние поезда до Москвы и Петербурга 
05-04-2020, Экономисты спрогнозировали двухлетнюю рецессию в России   
05-04-2020, Два франчайзинговых партнера KFC вошли в список системообразующих фирм 
05-04-2020, Список системообразующих предприятий России утвердят 10 апреля 
05-04-2020, Воробьев оценил необходимость пропускного режима в Подмосковье 
05-04-2020, Планка для каникул. В Сбербанке определили кредиты для взятия отсрочки 
05-04-2020, В Югре режим обязательной самоизоляции продлили до 1 мая 
05-04-2020, В оперштабе рассказали о режиме работы подмосковных организаций 
05-04-2020, Тонкие расчеты. ЦБ России о начислении процентов в кредитные каникулы 
05-04-2020, В России за полторы недели в 3,4 раза выросли продажи антисептиков 
05-04-2020, Чат-боты и новые меню: как выживают российские рестораны 
05-04-2020, Убьет ли нефть энергия будущего после коронавируса 
05-04-2020, ЦБ разъяснил, что кредитные каникулы не будут бесплатными 
05-04-2020, В России резко выросли продажи имбиря и чеснока из-за коронавируса  
05-04-2020, Частный российский производитель оружия попросил помощи у властей 
05-04-2020, Исследование: спрос россиян на микрозаймы в марте вырос почти на треть 
05-04-2020, Не до яблочка: почему россияне отказываются от фруктов 
05-04-2020, Назван тропический фрукт, который избежал удара коронавируса 
05-04-2020, В Минэкономразвития дали совет российскому бизнесу 
04-04-2020, Центробанк разъяснил условия кредитных каникул 
04-04-2020, Глава Росатома рассказал о строительстве АЭС за рубежом 
04-04-2020, В Москве определили штрафы для юрлиц за нарушения ограничений 
04-04-2020, Эксперты оценили последствия ограничения оборота алкоголя в регионах 
04-04-2020, В России ожидают поставки 55 миллионов масок из Китая 
04-04-2020, В офисе Зеленского заявили о скором снижении цен на топливо на Украине 
04-04-2020, Российский бизнес попросил снять ограничения на торговлю алкоголем 
04-04-2020, В России в четыре раза вырос объем производства антисептиков 
04-04-2020, В МЭР назвали факторы, влияющие на восстановление российской экономики 
04-04-2020, В Москве назвали условия введения системы контроля режима самоизоляции 
04-04-2020, Производители предупредили об угрозе дефицита бытовой техники 
04-04-2020, Эксперт раскритиковал меры ЕС для помощи экономике в борьбе с COVID-19 
04-04-2020, Эксперт назвал ответ Евросоюза на экономические проблемы смехотворным 
04-04-2020, Число случаев коронавируса в мире превысило 1,1 миллиона 
04-04-2020, Стоимость мексиканской нефти выросла вдвое 
04-04-2020, Эксперт объяснил рост продаж водки в России 
04-04-2020, В Калмыкии продлили режим самоизоляции из-за коронавируса   
04-04-2020, ЦБ не разрешил заемщикам переносить выплаты по кредитам на май 
04-04-2020, В ВЭФ оценили готовность мировых компаний к переходу на удаленку 
03-04-2020, В Росавиации подтвердили приостановку разрешений на вывозные рейсы 
03-04-2020, РФПИ передал США российско-японскую тест-систему на коронавирус 
03-04-2020, Аэрофлот сокращает количество внутренних рейсов 
03-04-2020, Источник сообщил об отзыве разрешений на вывозные рейсы 
03-04-2020, Победа вернет клиентам деньги за отмененные рейсы после 1 июня 
03-04-2020, Минпромторг призвал регионы отменить пропуска для большегрузов 
03-04-2020, Путин подписал закон о кредитных каникулах 
03-04-2020, В МВФ заявили, что мировая экономика остановилась 
03-04-2020, Минпромторг призвал регионы отменить пропуска для большегрузов 
03-04-2020, Путин подписал закон о кредитных каникулах 
03-04-2020, В МВФ заявили, что мировая экономика остановилась 
03-04-2020, В Москве три пациента с коронавирусом нарушили режим самоизоляции 
03-04-2020, ЦБ не исключил расширения списка отраслей для послаблений по кредитам 
03-04-2020, В ЦБ оценили вероятность роста безработицы из-за коронавируса 
03-04-2020, Набиуллина оценила влияние коронавируса на экономику России 
03-04-2020, Набиуллина призвала взвешенно подходить к использованию сбережений 
03-04-2020, В Москве еще 12 тысяч предприятий получили отсрочку по налогам 
03-04-2020, Союз виноделов предостерег от запрета продажи алкоголя из-за COVID-19 
03-04-2020, В ЦБ разъяснили, как будут работать кредитные каникулы из-за COVID-19 
03-04-2020, Все НПФ заблаговременно выплатили пенсии за март 
03-04-2020, ЦБ разъяснил порядок работы банков до конца апреля 
03-04-2020, Набиуллина оценила влияние нерабочего апреля на экономику 
03-04-2020, Каждый регион должен определить, какие предприятия продолжат работу 
03-04-2020, Мишустин призвал компании с госучастием не сокращать закупки у бизнеса 
03-04-2020, ВТБ рассказал о новом виде мошенничества с кредитными каникулами 
03-04-2020, Минпромторг призвал регионы организовать обеспечение населения масками 
03-04-2020, Минпромторг дал регионам рекомендации по  режиму продажи алкоголя 
03-04-2020, Власти проанализируют эффект от первого пакета мер поддержки бизнеса 
03-04-2020, В Кремле заявили, что знают о прогнозах развития экономики 
03-04-2020, Лукашенко поручил увеличить в Белоруссии производство гречки 
03-04-2020, ФосАгро стала лидером продаж удобрений на СПбМТСБ 
03-04-2020, Онлайн-ретейлеры пожаловались на задержания курьеров 
03-04-2020, В РЖД рассказали, когда восстановят отмененные поезда 
03-04-2020, Google начнет публиковать отчет о передвижениях для борьбы с COVID-19 
03-04-2020, Путин поручил принять меры по поддержке экономики в условиях пандемии  
03-04-2020, Путин поручил принять меры по преодолению последствий коронавируса 
03-04-2020, Путин поручил увеличить производство средств индивидуальной защиты 
03-04-2020, Роскачество рассказало о рисках наличных платежей в период пандемии 
03-04-2020, В Москве рассказали, как бизнес приспосабливается к новым условиям 
03-04-2020, В Якутии приняли меры стабилизации экономики после коронавируса 
03-04-2020, Названы отрасли в РФ, которые не пострадают из-за коронавируса 
03-04-2020, В Забайкалье сообщили, когда отменят полный запрет на продажу алкоголя 
03-04-2020, В Союзе пивоваров оценили последствия ограничения торговли пивом  
03-04-2020, Названы сферы экономики, которые не пострадают из-за коронавируса 
03-04-2020, Эксперт назвал валюты, на которых сейчас можно потерять все 
03-04-2020, Производители пива обратились в кабмин из-за ограничений в регионах 
02-04-2020, Профсоюзы предложили правительству провести в России национализацию 
02-04-2020, Эксперт объяснил необходимость введения жестких мер из-за COVID-19 
02-04-2020, В Москве продлили ограничения по коронавирусу 
02-04-2020, В Госдуме выступили за расширение помощи бизнесу до 30 апреля 
02-04-2020, В Удмуртии расширят список возобновляющих работу предприятий 
02-04-2020, Трамп рассказал о переговорах России и Саудовской Аравии по нефти 
02-04-2020, Чтобы потом не маялись. Путин продлил нерабочие дни до конца апреля 
02-04-2020, Леруа Мерлен перевела часть магазинов в РФ в онлайн 
02-04-2020, Новак рассказал об оценке Россией и США рынка нефти 
02-04-2020, Регионы будут согласовывать ограничения по COVID-19 с правительством 
02-04-2020, Регионы решат, какие учреждения продолжат работу в условиях COVID-19 
02-04-2020, Путин допустил возможность сокращения нерабочего периода 
02-04-2020, Путин призвал сохранить рабочие места и доходы граждан 
02-04-2020, В Москве около 11 тыс компаний могут быть освобождены от аренды 
02-04-2020, Почта России сократила сроки доставки 
02-04-2020, Минэнерго не исключило дальнейшего снижения цен на нефть 
02-04-2020, Новак оценил эффективность сделки ОПЕК+ в текущих условиях 
02-04-2020, В ОНФ рассказали о проблемах фермеров в условиях коронавируса 
02-04-2020, В Сколково не подтвердили эффективность Магнарила против COVID-19 
02-04-2020, Партия Роста предложила выдать россиянам сумму в размере двух МРОТ 
02-04-2020, Страховщики попросили Мишустина о поддержке 
02-04-2020, ФАС заявила о снижении цен на маски в шести регионах 
02-04-2020, Мэр утвердил штрафы за нарушение самоизоляции в Москве 
02-04-2020, Совфед одобрил списание долгов граждан-банкротов по платежам в бюджет 
02-04-2020, Эксперт: МФЦ не справляются с регистрацией сделок с недвижимостью 
02-04-2020, Совфед одобрил закон о кредитных каникулах 
02-04-2020, Китай направил в Россию гуманитарный груз 
02-04-2020, Уральские авиалинии вывезут из Индии российских туристов 
02-04-2020, Правительство выпустит постановление о закупке тестов на коронавирус 
02-04-2020, Минэнерго рассмотрело стресс-сценарий снижения спроса на энергоресурсы 
02-04-2020, Новак попросил Мишустина одобрить энергостратегию до 2035 года 
02-04-2020, Правительство разрешило продажу до миллиона тонн зерна из госфонда 
02-04-2020, Минск намерен сам определять поставщиков российской нефти 
02-04-2020, Тюменский губернатор ввел режим самоизоляции в регионе 
02-04-2020, Сбербанк получил 12 тысяч запросов от юрлиц на кредитные каникулы 
02-04-2020, В более чем 2 тыс торговых центров в РФ приостановлена торговля 
02-04-2020, Сбербанк разъяснил условия выдачи зарплатных кредитов бизнесу 
02-04-2020, Челябинская область закрыла въезд для машин из других регионов 
02-04-2020, Сбербанк не ожидает оттока вкладов из-за налога на процентные доходы 
02-04-2020, Господдержка россиян во время пандемии COVID-19 
02-04-2020, В ЕК предложили поддержать бизнес на фоне кризиса из-за коронавируса 
02-04-2020, Патрушев попросил банки не повышать ставки по кредитам для аграриев 
02-04-2020, Россия не планирует наращивать добычу нефти, заявил Новак 
02-04-2020, На Ставрополье число случаев коронавируса за сутки выросло до 15 
02-04-2020, Путин общается с Новаком в ежедневном режиме 
02-04-2020, Псковская область планирует продлить ограничения из-за коронавируса 
02-04-2020, Гендиректор Победы прокомментировал приостановку полетов лоукостера 
02-04-2020, В Минэнерго оценили потребление электроэнергии в выходную неделю 
02-04-2020, Власти направят 2,6 млрд рублей на зарплаты и поддержку ряда отраслей 
02-04-2020, Мишустин призвал не затягивать с подготовкой подзаконных актов 
02-04-2020, Президент Магнита призвал не ходить в магазины семьей 
02-04-2020, Все регионы ДФО ввели режим самоизоляции 
02-04-2020, Володин предложил поддержать грантами предприятия-производители масок 
02-04-2020, Российские рестораторы попросили правительство о поддержке 
